{
  "$schema": "./suite.schema.json",
  "schema_version": 1,
  "suite_id": "https://github.com/0al-spec/agent-surface/conformance/suite/v1",
  "suite_version": "1.10.8",
  "protocol_version": "agent-surface/0.1",
  "specification": {
    "path": "drafts/agent-surface.md",
    "hash_domain": "ASP-SPECIFICATION-SOURCE-V1"
  },
  "profiles": [
    {
      "profile_id": "https://github.com/0al-spec/agent-surface/conformance/surface-publisher/v1",
      "role": "surface_publisher",
      "requirement_ids": [
        "ASP-SP-001",
        "ASP-SP-002",
        "ASP-SP-003",
        "ASP-SP-004",
        "ASP-SP-005",
        "ASP-SP-006"
      ]
    },
    {
      "profile_id": "https://github.com/0al-spec/agent-surface/conformance/grant-issuer/v1",
      "role": "grant_issuer",
      "requirement_ids": [
        "ASP-GI-001",
        "ASP-GI-002",
        "ASP-GI-003",
        "ASP-GI-004",
        "ASP-GI-005",
        "ASP-GI-006"
      ]
    },
    {
      "profile_id": "https://github.com/0al-spec/agent-surface/conformance/action-executor/v1",
      "role": "action_executor",
      "requirement_ids": [
        "ASP-AE-001",
        "ASP-AE-002",
        "ASP-AE-003",
        "ASP-AE-004",
        "ASP-AE-005",
        "ASP-AE-006",
        "ASP-AE-007",
        "ASP-AE-008",
        "ASP-AE-009",
        "ASP-AE-010",
        "ASP-AE-011",
        "ASP-AE-012",
        "ASP-AE-013",
        "ASP-AE-014"
      ]
    },
    {
      "profile_id": "https://github.com/0al-spec/agent-surface/conformance/receipt-producer/v1",
      "role": "receipt_producer",
      "requirement_ids": [
        "ASP-RP-001",
        "ASP-RP-002",
        "ASP-RP-003",
        "ASP-RP-004",
        "ASP-RP-005",
        "ASP-RP-006"
      ]
    },
    {
      "profile_id": "https://github.com/0al-spec/agent-surface/conformance/runtime-mediator/v1",
      "role": "runtime_mediator",
      "requirement_ids": [
        "ASP-RM-001",
        "ASP-RM-002",
        "ASP-RM-003",
        "ASP-RM-004",
        "ASP-RM-005",
        "ASP-RM-006",
        "ASP-RM-007",
        "ASP-RM-008",
        "ASP-RM-009",
        "ASP-RM-010",
        "ASP-RM-011",
        "ASP-RM-012",
        "ASP-RM-013",
        "ASP-RM-014",
        "ASP-RM-015",
        "ASP-RM-016"
      ]
    },
    {
      "profile_id": "https://github.com/0al-spec/agent-surface/conformance/agent-adapter/v1",
      "role": "agent_adapter",
      "requirement_ids": [
        "ASP-AA-001",
        "ASP-AA-002",
        "ASP-AA-003",
        "ASP-AA-004",
        "ASP-AA-005",
        "ASP-AA-006",
        "ASP-AA-007"
      ]
    }
  ],
  "features": [
    {
      "feature_id": "agent-surface/feature/impact-simulation",
      "title": "Impact Simulation",
      "rfc_anchor": "impact-simulation",
      "requirement_ids": [
        "ASP-RM-014"
      ]
    },
    {
      "feature_id": "agent-surface/feature/proposal-only",
      "title": "Proposal-Only Surface Mode",
      "rfc_anchor": "proposal-only-surface-mode",
      "requirement_ids": [
        "ASP-SP-002"
      ]
    },
    {
      "feature_id": "agent-surface/feature/risk-explanation-ui-hints",
      "title": "Risk Explanation UI Hints",
      "rfc_anchor": "risk-explanation-ui-hints",
      "requirement_ids": [
        "ASP-SP-004",
        "ASP-RM-013"
      ]
    },
    {
      "feature_id": "https://github.com/0al-spec/agent-surface/profiles/agent-passport-minimal/v1",
      "title": "Minimal Agent Passport Grant-Issuance Profile",
      "rfc_anchor": "minimal-agent-passport-grant-issuance-profile",
      "requirement_ids": [
        "ASP-GI-003"
      ]
    },
    {
      "feature_id": "https://github.com/0al-spec/agent-surface/profiles/runtime-identity/v1",
      "title": "Runtime Identity Profile",
      "rfc_anchor": "runtime-identity-profile",
      "requirement_ids": [
        "ASP-AE-005"
      ]
    },
    {
      "feature_id": "https://github.com/0al-spec/agent-surface/profiles/remote-processing-privacy/v1",
      "title": "Remote Processing Privacy Profile",
      "rfc_anchor": "remote-processing-privacy-profile",
      "requirement_ids": [
        "ASP-RM-006"
      ]
    },
    {
      "feature_id": "https://github.com/0al-spec/agent-surface/profiles/agent-training-use/v1",
      "title": "Agent Training Use Policy Profile",
      "rfc_anchor": "agent-training-use-policy-profile",
      "requirement_ids": [
        "ASP-RM-007"
      ]
    },
    {
      "feature_id": "https://github.com/0al-spec/agent-surface/profiles/runtime-attestation/v1",
      "title": "Runtime Attestation Optional Profile",
      "rfc_anchor": "runtime-attestation-optional-profile",
      "requirement_ids": [
        "ASP-AE-006"
      ]
    },
    {
      "feature_id": "https://github.com/0al-spec/agent-surface/profiles/approval-receipt/v1",
      "title": "Approval Receipt Profile",
      "rfc_anchor": "approval-receipt-profile",
      "requirement_ids": [
        "ASP-AE-007"
      ]
    },
    {
      "feature_id": "https://github.com/0al-spec/agent-surface/profiles/capability-match-result/v1",
      "title": "Capability Match Result Profile",
      "rfc_anchor": "capability-match-result-object",
      "requirement_ids": [
        "ASP-RM-008"
      ]
    },
    {
      "feature_id": "https://github.com/0al-spec/agent-surface/profiles/operational-limits/v1",
      "title": "Operational Limits Profile",
      "rfc_anchor": "rate-limits-and-quotas",
      "requirement_ids": [
        "ASP-SP-003",
        "ASP-AE-009",
        "ASP-AE-010",
        "ASP-RM-009",
        "ASP-AE-011",
        "ASP-RM-010"
      ]
    },
    {
      "feature_id": "https://github.com/0al-spec/agent-surface/profiles/asp-over-ahp/v1",
      "title": "ASP-over-AHP Binding Profile",
      "rfc_anchor": "asp-over-ahp-binding-profile",
      "requirement_ids": [
        "ASP-RM-011",
        "ASP-AA-005"
      ]
    },
    {
      "feature_id": "https://github.com/0al-spec/agent-surface/profiles/human-elicitation/v1",
      "title": "Human Elicitation Events Profile",
      "rfc_anchor": "human-elicitation-events-profile",
      "requirement_ids": [
        "ASP-AA-006",
        "ASP-AE-012",
        "ASP-RM-012"
      ]
    },
    {
      "feature_id": "https://github.com/0al-spec/agent-surface/profiles/asp-over-mcp/v1",
      "title": "ASP-over-MCP Binding Profile",
      "rfc_anchor": "asp-over-mcp-binding-profile",
      "requirement_ids": [
        "ASP-SP-005",
        "ASP-AE-013",
        "ASP-RM-015",
        "ASP-AA-007",
        "ASP-GI-005"
      ]
    },
    {
      "feature_id": "https://github.com/0al-spec/agent-surface/profiles/purpose-task-bound-grant/v1",
      "title": "Purpose- and Task-Bound Agent Grant Profile",
      "rfc_anchor": "purpose-and-task-bound-agent-grant-profile",
      "requirement_ids": [
        "ASP-SP-006",
        "ASP-GI-006",
        "ASP-AE-014",
        "ASP-RM-016"
      ]
    }
  ],
  "requirements": [
    {
      "requirement_id": "ASP-SP-001",
      "title": "Publish a complete manifest with an injective surface version and hash binding",
      "profile_id": "https://github.com/0al-spec/agent-surface/conformance/surface-publisher/v1",
      "rfc_anchor": "surface-publisher-profile",
      "applicability": {
        "kind": "always"
      },
      "execution_class": "static",
      "vector_ids": [
        "ASP-V-SP-001",
        "ASP-V-SP-002",
        "ASP-V-SP-003"
      ]
    },
    {
      "requirement_id": "ASP-SP-002",
      "title": "Keep a proposal-only surface closed over read and propose semantics",
      "profile_id": "https://github.com/0al-spec/agent-surface/conformance/surface-publisher/v1",
      "rfc_anchor": "proposal-only-surface-mode",
      "applicability": {
        "kind": "feature",
        "feature_id": "agent-surface/feature/proposal-only"
      },
      "execution_class": "static",
      "vector_ids": [
        "ASP-V-SP-004"
      ]
    },
    {
      "requirement_id": "ASP-GI-001",
      "title": "Issue only an exact attenuation of the current verified surface and request",
      "profile_id": "https://github.com/0al-spec/agent-surface/conformance/grant-issuer/v1",
      "rfc_anchor": "grant-issuer-profile",
      "applicability": {
        "kind": "always"
      },
      "execution_class": "behavioral",
      "vector_ids": [
        "ASP-V-GI-001",
        "ASP-V-GI-002",
        "ASP-V-GI-003"
      ]
    },
    {
      "requirement_id": "ASP-GI-002",
      "title": "Reject an action allow-list not closed over required companions",
      "profile_id": "https://github.com/0al-spec/agent-surface/conformance/grant-issuer/v1",
      "rfc_anchor": "grant-issuer-profile",
      "applicability": {
        "kind": "always"
      },
      "execution_class": "behavioral",
      "vector_ids": [
        "ASP-V-GI-001",
        "ASP-V-GI-004"
      ]
    },
    {
      "requirement_id": "ASP-GI-003",
      "title": "Fail closed when selected Passport status is unavailable",
      "profile_id": "https://github.com/0al-spec/agent-surface/conformance/grant-issuer/v1",
      "rfc_anchor": "minimal-agent-passport-grant-issuance-profile",
      "applicability": {
        "kind": "feature",
        "feature_id": "https://github.com/0al-spec/agent-surface/profiles/agent-passport-minimal/v1"
      },
      "execution_class": "behavioral",
      "vector_ids": [
        "ASP-V-GI-005"
      ]
    },
    {
      "requirement_id": "ASP-GI-004",
      "title": "Apply semantic revocation to the Grant lineage before confirming",
      "profile_id": "https://github.com/0al-spec/agent-surface/conformance/grant-issuer/v1",
      "rfc_anchor": "revocation-semantics",
      "applicability": {
        "kind": "always"
      },
      "execution_class": "behavioral",
      "vector_ids": [
        "ASP-V-GI-006",
        "ASP-V-GI-007"
      ]
    },
    {
      "requirement_id": "ASP-AE-001",
      "title": "Independently verify the exact active Grant and delegate tuple before admission",